name,year,competition_category,winner,url,summary,countries,languages,genre,metascore
Lost in Translation,2003,DIRECTING,FALSE,https://www.metacritic.com/movie/lost-in-translation/details,"Unable to sleep, Bob (Murray) and Charlotte (Johansson), two Americans in Tokyo, cross paths one night in the luxury hotel bar. This chance meeting soon becomes a surprising friendship. Charlotte and Bob venture through Tokyo, having often hilarious encounters with its citizens, and ultimately discover a new belief in life's possibilities. (Focus Features)","['USA', 'Japan']","['English', 'German', 'French', 'Japanese']","['Drama', 'Romance']",89
Mystic River,2003,DIRECTING,FALSE,https://www.metacritic.com/movie/mystic-river/details,"As the investigation of the death of a young woman tightens around three old friends, and ominous story unfolds that revolves around friendship, family and innocence lost too soon.  (Warner Bros.)","['USA', 'Australia']",['English'],"['Drama', 'Mystery', 'Thriller', 'Crime']",84
The Barbarian Invasions,2003,FOREIGN LANGUAGE FILM,TRUE,https://www.metacritic.com/movie/the-barbarian-invasions/details,"Director Denys Arcand revisits the situations and relationships that informed his international breakthrough The Decline of the American Empire.  Set 17 years after Decline, this film, like its predecessor, examines the varying politics -- economic, personal and sexual -- at play among a group of friends, lovers and ex-spouses.  [Miramax]","['France', 'Canada']","['English', 'French']","['Drama', 'Mystery', 'Comedy', 'Romance', 'Crime']",70
The Twilight Samurai,2003,FOREIGN LANGUAGE FILM,FALSE,https://www.metacritic.com/movie/the-twilight-samurai/details,"A family drama set in the late nineteenth century Japan, as the feudal Shogun period was giving way to the Meiji Restoration. [Empire Pictures]",['Japan'],['Japanese'],"['Drama', 'Romance']",82
Zelary,2003,FOREIGN LANGUAGE FILM,FALSE,https://www.metacritic.com/movie/zelary/details,"Set in the 1940s in the Czech lands occupied by the Nazis, Zelary tells the story of a clash between two different worlds and two different people. It is the story of an extraordinary relationship, of fear, misgivings, suspicion and especially of the love that forms out of antagonism.  (Sony Pictures Classics)","['Czech Republic', 'Slovakia', 'Austria']","['German', 'Russian', 'Czech']","['Drama', 'Romance']",66
Seabiscuit,2003,BEST PICTURE,FALSE,https://www.metacritic.com/movie/seabiscuit/details,The tale of a down-and-out racehorse that took the entire nation on the ride of a lifetime.  (Universal Pictures),['USA'],['English'],"['Drama', 'History', 'Sport']",72
The Aviator,2004,DIRECTING,FALSE,https://www.metacritic.com/movie/the-aviator/details,Leonardo DiCaprio stars as aviation pioneer Howard Hughes in this biopic directed by Martin Scorsese.,"['USA', 'Germany']",['English'],"['Biography', 'Drama']",77
Million Dollar Baby,2004,DIRECTING,TRUE,https://www.metacritic.com/movie/million-dollar-baby/details,Two retired boxers who run a Los Angeles gym are caught off guard when a woman approaches them with her dream of stepping into the ring.,['USA'],"['English', 'Irish Gaelic']","['Drama', 'Sport']",86
Ray,2004,DIRECTING,FALSE,https://www.metacritic.com/movie/ray/details,"Ray is the never-before-told, musical biographical drama of American legend Ray Charles. Featuring Jamie Foxx in the central role, Ray follows the inspiring story of a one-of-a-kind genius.  (Universal)",['USA'],['English'],"['Biography', 'Drama', 'Music']",73
Sideways,2004,DIRECTING,FALSE,https://www.metacritic.com/movie/sideways/details,"Two old friends set off on a wine-tasting road trip...only to veer dizzily sideways into a wry, comedic exploration of the crazy vicissitudes of love and friendship, the damnable persistence of loneliness and dreams and the enduring war between Pinot and Cabernet.  [Fox Searchlight Pictures]","['USA', 'Hungary']","['English', 'Armenian']","['Drama', 'Comedy', 'Romance']",94
Vera Drake,2004,DIRECTING,FALSE,https://www.metacritic.com/movie/vera-drake/details,A portrait of a back street abortionist in 1950's London.,"['UK', 'France', 'New Zealand']",['English'],"['Drama', 'Crime']",83
Downfall,2004,FOREIGN LANGUAGE FILM,FALSE,https://www.metacritic.com/movie/downfall/details,A portrait of Hitler's final days in his Berlin bunker at the end of WWII.,"['Germany', 'Italy', 'Austria']","['German', 'Russian']","['Biography', 'Drama', 'History', 'War']",82
The Sea Inside,2004,FOREIGN LANGUAGE FILM,TRUE,https://www.metacritic.com/movie/the-sea-inside/details,"Based on the profoundly moving true story that captured the world's attention, The Sea Inside is about Spaniard Ramon Sampedro (Bardem), who fought a 30-year campaign to win the right to end his life with dignity.  The film is the story of Ramon's relationships with two women: Julia (Rueda), a lawyer who supports his cause, and Rosa (Duenas), a local woman who wants to convince him that life is worth living.  (Fine Line Features)","['Spain', 'France', 'Italy']","['Spanish', 'Catalan', 'Galician']","['Biography', 'Drama']",74
Finding Neverland,2004,BEST PICTURE,FALSE,https://www.metacritic.com/movie/finding-neverland/details,"A tale of magic and fantasy inspired by the life of James Barrie, the real-life author of the children's classic Peter Pan.  (Miramax)","['USA', 'UK']",['English'],"['Biography', 'Drama', 'Family']",67
Brokeback Mountain,2005,DIRECTING,TRUE,https://www.metacritic.com/movie/brokeback-mountain/details,"Set against the sweeping vistas of Wyoming and Texas, the film tells the story of two young men -- a ranch-hand and a rodeo cowboy -- who meet in the summer of 1963, and unexpectedly forge a lifelong connection, one whose complications, joys, and tragedies provide a testament to the endurance and power of love.  (Focus Features)","['USA', 'Canada']",['English'],"['Drama', 'Romance', 'Western']",87
Capote,2005,DIRECTING,FALSE,https://www.metacritic.com/movie/capote/details,"A profile of Truman Capote during the years he researched the story that was to become the basis for the book ""In Cold Blood.""","['USA', 'Canada']",['English'],"['Biography', 'Drama', 'Crime']",88
Crash,2005,DIRECTING,FALSE,https://www.metacritic.com/movie/crash/details,"A provocative, unflinching look at the complexities of racial tolerance in contemporary America. Diving headlong into the diverse melting pot of post-9/11 Los Angeles, this compelling urban drama tracks the volatile intersections of a multi-ethnic case of characters' struggles to overcome their fears as they careen in and out of one another's lives. (Lions Gate Films) ","['USA', 'Germany']","['English', 'Mandarin', 'Spanish', 'Persian', 'Korean']","['Drama', 'Crime']",66
Munich,2005,DIRECTING,FALSE,https://www.metacritic.com/movie/munich/details,"Steven Spielberg directs an international cast in Munich, a gripping suspense thriller set in the aftermath of the massacre of 11 Israeli athletes at the 1972 Munch Olympics. This dramatic exploration inspired by true events follows a secret Israeli squad assigned to track down and kill the 11 Palestinians suspected to have planned the Munich attack -- and the personal toll this mission of revenge takes on the team and the man who led it. (Universal Pictures)","['USA', 'France', 'Canada']","['English', 'German', 'French', 'Arabic', 'Russian', 'Italian', 'Hebrew', 'Greek']","['Drama', 'History', 'Thriller']",74
Don't Tell,2005,FOREIGN LANGUAGE FILM,FALSE,https://www.metacritic.com/movie/dont-tell-2005/details,Rachel Johannes (Eastwood)‚ a young aspiring restaurateur living in Los Angeles‚ is forced to revisit her complex and troubling past when her abusive father dies unexpectedly on the family farm back in her small‚ Midwestern hometown.,['USA'],['English'],['Drama'],22
Paradise Now,2005,FOREIGN LANGUAGE FILM,FALSE,https://www.metacritic.com/movie/paradise-now/details,Paradise Now is the story of two young Palestinian men as they embark upon what may be the last 48 hours of their lives.  (Warner Independent Pictures),"['Germany', 'France', 'Israel', 'Netherlands', 'Occupied Palestinian Territory']","['English', 'Arabic']","['Drama', 'Crime']",71
Sophie Scholl: The Final Days,2005,FOREIGN LANGUAGE FILM,FALSE,https://www.metacritic.com/movie/sophie-scholl-the-final-days/details,"The true story of Germany's most famous anti-Nazi heroine is brought to thrilling life in Germany's official Foreign Language Film selection for the 2005 Academy Awards.  Sophie Scholl stars Julia Jentsch in a luminous performance as the young coed-turned-fearless activist. Armed with long-buried historical records of her incarceration, director Marc Rothemund expertly re-creates the last six days of Sophie Scholl's life: a heart-stopping journey from arrest to interrogation, trial and sentence.  (Zeitgeist Films)",['Germany'],['German'],"['Biography', 'Drama', 'History', 'Crime', 'War']",76
Tsotsi,2005,FOREIGN LANGUAGE FILM,TRUE,https://www.metacritic.com/movie/tsotsi/details,"Set amidst the bustling townships of Johannesburg and infused with the pumping high-energy Kwaito music of the top South African artist Zola, Tsotsi is an extraordinary portrait of the choices we make in life and the personal triumph that comes from choosing love over rage.  (Miramax Films)","['UK', 'South Africa']","['English', 'Afrikaans', 'Xhosa', 'Zulu']","['Drama', 'Crime']",70
Babel,2006,DIRECTING,FALSE,https://www.metacritic.com/movie/babel/details,"In the remote sands of the Moroccan desert, a rifle shot rings out -- detonating a chain of events that will link an American tourist couple's frantic struggle to survive, two Moroccan boys involved in an accidental crime, a nanny illegally crossing into Mexico with two American children and a Japanese teen rebel whose father is sought by the police in Tokyo.  (Paramount Vantage)","['USA', 'Mexico', 'France']","['English', 'French', 'Spanish', 'Arabic', 'Japanese', 'Japanese Sign Language', 'Berber']",['Drama'],69
The Departed,2006,DIRECTING,TRUE,https://www.metacritic.com/movie/the-departed/details,"This gritty crime drama from director Martin Scorsese takes us into the lives of two cops: Colin Sullivan (Matt Damon), smart and unabashedly ambitious, appears to be on the fast track in the Massachusetts State Police Department's elite Special Investigations Unit, whose prime target is powerful Irish mob boss Frank Costello (Jack Nicholson). Billy Costigan (Leonardo DiCaprio), street-smart and tough, is purported to have a violent temper that costs him his badge and eventually lands him back on the rough streets of South Boston, where he is recruited into Costello's ranks. But neither man is what he seems and, as they work at cross purposes, they are plunged into a dangerous game of cat and mouse in which the stakes could not be higher.  [Warner Bros.]","['USA', 'Hong Kong']","['English', 'Cantonese']","['Mystery', 'Thriller', 'Crime']",85
Letters from Iwo Jima,2006,DIRECTING,FALSE,https://www.metacritic.com/movie/letters-from-iwo-jima/details,"In this companion piece to ""Flags of Our Fathers,"" Clint Eastwood presents the untold story of the Japanese soldiers and their general who 61 years ago defended against the invading American forces on the island of Iwo Jima.  (Warner Bros.)",['USA'],"['English', 'Japanese']","['Drama', 'History', 'War']",89
The Queen,2006,DIRECTING,FALSE,https://www.metacritic.com/movie/the-queen/details,"The Queen takes audiences behind the scenes of one of the most shocking public events of recent times -- providing an illuminating, deeply affecting and dramatic glimpse into what happens in the corridors of power when a tragedy strikes.  (Miramax)","['UK', 'France', 'Italy']","['English', 'German', 'French']","['Biography', 'Drama']",91
United 93,2006,DIRECTING,FALSE,https://www.metacritic.com/movie/united-93/details,"Acclaimed filmmaker Paul Greengrass writes and directs an unflinching drama that tells the story of the passengers and crew, their families on the ground and the flight controllers who watched in dawning horror as United Flight 93 became the fourth hijacked plane on the day of the worst terrorist attacks on American soil: September 11, 2001.  (Universal Pictures)","['USA', 'UK', 'France']","['English', 'German', 'Arabic']","['Drama', 'History', 'Crime']",90
The Lives of Others,2006,FOREIGN LANGUAGE FILM,TRUE,https://www.metacritic.com/movie/the-lives-of-others/details,"At once a political thriller and human drama, The Lives of Others begins in East Berlin in 1984, five years before Glasnost and the fall of the Berlin Wall and ultimately takes us to 1991, in what is now the reunited Germany. The film traces the gradual disillusionment of Captain Gerd Wiesler, a highly skilled officer who works for the Stasi, East Germany's all-powerful secret police.  (Sony Pictures Classics)",['Germany'],['German'],"['Drama', 'Thriller']",89
Pan's Labyrinth,2006,FOREIGN LANGUAGE FILM,FALSE,https://www.metacritic.com/movie/pans-labyrinth/details,"Following a bloody civil war, young Ofelia enters a world of unimaginable cruelty when she moves in with her new stepfather, a tyrannical military officer. Armed with only her imagination, Ofelia discovers a mysterious labyrinth and meets a faun who sets her on a path to saving herself and her ailing mother. But soon, the lines between fantasy and reality begin to blur, and before Ofelia can turn back, she finds herself at the center of a ferocious battle between good and evil. [Warner Bros.]","['USA', 'Spain', 'Mexico']",['Spanish'],"['Drama', 'Mystery', 'Thriller', 'Fantasy', 'War']",98
Water,2006,FOREIGN LANGUAGE FILM,FALSE,https://www.metacritic.com/movie/water/details,"Set in 1938 Colonial India, against Mahatma Gandhi's rise to power, Water begins when 8-year-old Chuyia is widowed and sent to a home where Hindu widows must live in penitence.  (Fox Searchlight)","['India', 'Canada']",['Hindi'],"['Drama', 'Romance']",77
Little Miss Sunshine,2006,BEST PICTURE,FALSE,https://www.metacritic.com/movie/little-miss-sunshine/details,"Little Miss Sunshine is an American family road comedy that shatters the mold. Brazenly satirical and yet deeply human, the film introduces audiences to one of the most endearingly fractured families in recent cinema history: the Hoovers, whose trip to a pre-pubescent beauty pageant results not only in comic mayhem but in death, transformation and a moving look at the surprising rewards of being losers in a winning-crazed culture.  (Fox Searchlight Pictures)",['USA'],['English'],"['Adventure', 'Drama', 'Comedy']",80
The Diving Bell and the Butterfly,2007,DIRECTING,FALSE,https://www.metacritic.com/movie/the-diving-bell-and-the-butterfly/details,"The Diving Bell and the Butterfly is the remarkable true story of Jean-Dominique Bauby, a successful and charismatic editor-in-chief of French Elle, who believes he is living his life to its absolute fullest when a sudden stroke leaves him in a life-altered state. While the physical challenges of Bauby's fate leave him with little hope for the future, he begins to discover how his life's passions, his rich memories and his newfound imagination can help him achieve a life without boundaries. (Miramax Film)","['USA', 'France']",['French'],"['Biography', 'Drama']",92
Juno,2007,DIRECTING,FALSE,https://www.metacritic.com/movie/juno/details,"Juno stars Ellen Page as the title character, a whip-smart teen confronting an unplanned pregnancy by her classmate Bleeker. With the help of her hot best friend, Leah, Juno finds her unborn child a ""perfect"" set of parents: an affluent suburban couple, Mark and Vanessa, longing to adopt. Luckily, Juno has the total support of her parents as she faces some tough decisions, flirts with adulthood, and ultimately figures out where she belongs. [Fox Searchlight Pictures]","['USA', 'Canada']",['English'],"['Drama', 'Comedy']",81
Michael Clayton,2007,DIRECTING,FALSE,https://www.metacritic.com/movie/michael-clayton/details,"Michael Clayton (George Clooney) is an in-house ""fixer"" at one of the largest corporate law firms in New York. At the behest of the firm’s co-founder Marty Bach, Clayton, a former prosecutor from a family of cops, takes care of Kenner, Bach & Ledeen’s dirtiest work.  Clayton cleans up clients’ messes, handling anything from hit-and-runs and damaging stories in the press to shoplifting wives and crooked politicians. Burned out and discontented in his job, Clayton is inextricably tied to the firm.  At the agrochemical company U/North, the career of in-house chief counsel Karen Crowder rests on the settlement of the suit that Kenner, Bach & Ledeen is leading to a seemingly successful conclusion.  When the firms top litigator, the brilliant Arthur Edens, has an apparent breakdown and tries to sabotage the entire case, Marty Back sends Michael Clayton to tackle this unprecedented disaster and in doing so, Clayton comes face to face with the reality of what he has become. (Warner Bros.)",['USA'],['English'],"['Drama', 'Mystery', 'Thriller', 'Crime']",82
No Country for Old Men,2007,DIRECTING,TRUE,https://www.metacritic.com/movie/no-country-for-old-men/details,"The time is our own, when rustlers have given way to drug runners and small towns have become free-fire zones. The story begins when Llewelyn Moss finds a pickup truck surrounded by a sentry of dead men. A load of heroin and 2 million dollars in cash are still in the back. When Moss takes the money, he sets off a chain reaction of catastrophic violence that not even the law, in the person of aging, disillusioned Sheriff Bell, can contain. As Moss tries to evade his pursuers--in particular, a mysterious mastermind who flips coins for human lives--the film simultaneously strips down the American crime drama and broadens its concerns to encompass themes as ancient as the Bible and as bloodily contemporary as this morning's headline. (Miramax)",['USA'],"['English', 'Spanish']","['Drama', 'Thriller', 'Crime', 'Western']",91
There Will Be Blood,2007,DIRECTING,FALSE,https://www.metacritic.com/movie/there-will-be-blood/details,"When Daniel Plainview gets a mysterious tip-off that there's a little town out West where an ocean of oil is oozing out of the ground, he heads there with his son, H.W., to take their chances in dust-worn Little Boston. In this hardscrabble town, where the main excitement centers around the Holy Roller church of charismatic preacher Eli Sunday, Plainview and H.W. make their lucky strike. But even as the well raises all of their fortunes, nothing will remain the same as conflicts escalate and every human value—love, hope, community, belief, ambition, and even the bond between father and son—is imperiled by corruption, deception, and the flow of oil. [Paramount Vantage]",['USA'],"['English', 'American Sign Language']","['Drama', 'Thriller']",93
The Counterfeiters,2007,FOREIGN LANGUAGE FILM,TRUE,https://www.metacritic.com/movie/the-counterfeiters/details,"The true story of Salomon Sorowitsch, counterfeiter extraordinaire and bohemian who was in captured by the Nazis in 1944. He agrees to help the Nazis in an organized counterfeiting operation set up to finance the war effort. It was the biggest counterfeit-money scam of all time. Over 130 million pounds sterling were printed under conditions that couldn't have been more tragic or spectacular. During the last years of the war, as the German Reich saw that the end was near, the authorities decided to produce their own banknotes in the currencies of their major war enemies. They hoped to use the duds to flood the enemy economy and fill the empty war coffers. At the Sachsenhausen concentration camp, two barracks were separated from the rest of the camp and the outside world, and transformed into a fully equipped counterfeiters workshop. ""Operation Bernhard"" was born. Prisoners were brought to Sachsenhausen from other camps to implement the plan, and professional printers, fastidious bank officials, and simple craftsmen all became members of the top-secret counterfeiter crew. They had a choice: If they cooperated with the enemy, they had a chance to survive as first-class prisoners in a ""golden cage"" with enough to eat and a bed to sleep in. If they sabotaged the operation, a sure death awaited them. For the counterfeiters, it was not only a question of saving their own lives, but also about saving their conscience as well... (Sony Classics)","['Germany', 'Austria']","['English', 'German', 'Russian', 'Hebrew']","['Drama', 'Crime', 'War']",78
Katyn,2007,FOREIGN LANGUAGE FILM,FALSE,https://www.metacritic.com/movie/katyn/details,"In 1941, during their march on Moscow, the Nazis discovered the mass graves of 22,00 Polish intellectuals, clergy and officers. Katyn is the story of Joseph Stalin's order to execute these people.",['Poland'],"['German', 'Russian', 'Polish']","['Drama', 'History', 'War']",81
Mongol: The Rise of Genghis Khan,2007,FOREIGN LANGUAGE FILM,FALSE,https://www.metacritic.com/movie/mongol-the-rise-of-genghis-khan/details,"Mongol illuminates the life and legend of Genghis Khan.  Based on leading scholarly accounts and Mongol delves into the dramatic and harrowing early years of the ruler who was born as Temudgin in 1162. As it follows Temudgin from his perilous childhood to the battle that sealed his destiny, the film paints a multidimensional portrait of the future conqueror, revealing him not as the evil brute of hoary stereotype, but as an inspiring, fearless and visionary leader. Mongol shows us the making of an extraordinary man, and the foundation on which so much of his greatness rested: his relationship with his wife, Borte, his lifelong love and most trusted advisor.   (Picturehouse)
","['Russia', 'Germany', 'Kazakhstan', 'Mongolia']","['Mandarin', 'Mongolian']","['Biography', 'Drama', 'Romance', 'War']",74
12,2007,FOREIGN LANGUAGE FILM,FALSE,https://www.metacritic.com/movie/12/details,"A loose remake of “12 Angry Men”, 12 is set in contemporary Moscow where 12 very different men must unanimously decide the fate of a young Chechen accused of murdering his step-father, a Russian army officer. Consigned to a makeshift jury room in a school gymnasium, one by one each man takes center stage to confront, connect, and confess while the accused awaits a verdict and revisits his heartbreaking journey through war in flashbacks. (Sony Picture Classics)",['Russia'],"['Russian', 'Chechen']","['Drama', 'Thriller', 'Crime', 'War']",72
Atonement,2007,BEST PICTURE,FALSE,https://www.metacritic.com/movie/atonement/details,"Atonement spans several decades. In 1935, 13-year-old fledgling writer Briony Tallis and her family live a life of wealth and privilege in their enormous mansion. On the warmest day of the year, the country estate takes on an unsettling hothouse atmosphere, stoking Briony's vivid imagination. Robbie Turner, the educated son of the family's housekeeper, carries a torch for Briony's headstrong older sister, Cecilia. Cecilia, he hopes, has comparable feelings; all it will take is one spark for this relationship to combust. When it does, Briony--who has a crush on Robbie--is compelled to interfere, going so far as to accuse Robbie of a crime he did not commit. Cecilia and Robbie declare their love for each other, but Robbie is arrested--and with Briony bearing false witness, the course of three lives is changed forever. Briony continues to seek forgiveness for her childhood misdeed. Through a terrible and courageous act of imagination, she finds the path to her uncertain atonement and to an understanding of the power of enduring love. (Focus Features)","['UK', 'France']","['English', 'French']","['Drama', 'Mystery', 'Romance', 'War']",85
The Curious Case of Benjamin Button,2008,DIRECTING,FALSE,https://www.metacritic.com/movie/the-curious-case-of-benjamin-button/details,"“I was born under unusual circumstances.” And so begins The Curious Case of Benjamin Button, adapted from the 1920s story by F. Scott Fitzgerald about a man who is born in his eighties and ages backwards: a man, like any of us, who is unable to stop time. We follow his story, set in New Orleans from the end of World War I in 1918, into the 21st century, following his journey that is as unusual as any man’s life can be. Benjamin Button is a grand tale of a not-so-ordinary man and the people and places he discovers along the way, the loves he finds, the joys of life and the sadness of death, and what lasts beyond time. (Paramount Pictures)",['USA'],"['English', 'French', 'Russian']","['Drama', 'Mystery', 'Fantasy', 'Romance']",70
Milk,2008,DIRECTING,FALSE,https://www.metacritic.com/movie/milk/details,"In 1977, Harvey Milk was elected to the San Francisco Board of Supervisors, becoming the first openly gay man to be voted into major public office in America. His victory was not just a victory for gay rights; he forged coalitions across the political spectrum. From senior citizens to union workers, Harvey Milk changed the very nature of what it means to be a fighter for human rights and became, before his untimely death in 1978, a hero for all Americans. (Focus Features)",['USA'],['English'],"['Biography', 'Drama']",84
The Reader,2008,DIRECTING,FALSE,https://www.metacritic.com/movie/the-reader/details,"The Reader opens in post-WWII Germany when teenager Michael Berg becomes ill and is helped home by Hanna, a stranger twice his age.  Michael recovers from scarlet fever and seeks out Hanna to thank her.  The two are quickly drawn into a passionate but secretive affair. (The Weinstein Company)","['USA', 'Germany']","['English', 'German', 'Latin', 'Greek']","['Drama', 'Romance']",58
