name,year,competition_category,winner,url,summary,countries,languages,genre,metascore
Terms of Endearment,1983,DIRECTING,TRUE,https://www.metacritic.com/movie/terms-of-endearment/details,"Following the mother-daughter relationship of Aurora Greenway (MacLaine) who doesn't like it when her daughter Emma (Winger) marries Flap (Daniels).
",['USA'],['English'],"['Drama', 'Comedy', 'Romance']",79
The Big Chill,1983,BEST PICTURE,FALSE,https://www.metacritic.com/movie/the-big-chill/details,"Good friends reunite for the funeral of a college pal. During the weekend that follows, they compare their 60's ideas with the harsh reality of their lives in the 80's, and discover that in a cold world, you need your friends to keep you warm. [Sony Pictures]",['USA'],['English'],"['Drama', 'Comedy']",61
The Right Stuff,1983,BEST PICTURE,FALSE,https://www.metacritic.com/movie/the-right-stuff/details,"The story of the original Mercury 7 astronauts and their macho, seat-of-the-pants approach to the space program.",['US'],"['English', 'Russian']","['Adventure', 'Biography', 'Drama', 'History']",91
Broadway Danny Rose,1984,DIRECTING,FALSE,https://www.metacritic.com/movie/broadway-danny-rose/details,"In his attempts to reconcile a lounge singer with his mistress, a hapless talent agent is mistaken as her lover by a jealous gangster.",['US'],"['English', 'Italian', 'Yiddish']",['Comedy'],82
The Killing Fields,1984,DIRECTING,FALSE,https://www.metacritic.com/movie/the-killing-fields/details,"A photographer is trapped in Cambodia during tyrant Pol Pot's bloody ""Year Zero"" cleansing campaign, which claimed the lives of two million ""undesirable"" civilians.",['UK'],"['English', 'French', 'Russian', 'Central Khmer']","['Drama', 'History', 'War']",76
A Passage to India,1984,DIRECTING,FALSE,https://www.metacritic.com/movie/a-passage-to-india/details,"Cultural mistrust and false accusations doom a friendship in British colonial India between an Indian doctor, an Englishwoman engaged to marry a city magistrate, and an English educator.","['GB', 'US']","['English', 'Hindi']","['Adventure', 'Drama', 'History']",78
Places in the Heart,1984,DIRECTING,FALSE,https://www.metacritic.com/movie/places-in-the-heart/details,"In central Texas in the 1930s, a widow, with two small children, tries to run her small 40-acre farm with the help of two disparate people.",['US'],['English'],['Drama'],70
A Soldier's Story,1984,BEST PICTURE,FALSE,https://www.metacritic.com/movie/a-soldiers-story/details,An African American officer investigates a murder in a racially charged situation in World War II.,['US'],['English'],"['Drama', 'Mystery', 'Crime', 'War']",66
Out of Africa,1985,DIRECTING,TRUE,https://www.metacritic.com/movie/out-of-africa/details,"In 20th-century colonial Kenya, a Danish baroness/plantation owner has a passionate love affair with a free-spirited big-game hunter.","['GB', 'US']","['English', 'Swahili']","['Biography', 'Drama', 'Romance']",69
Prizzi's Honor,1985,DIRECTING,FALSE,https://www.metacritic.com/movie/prizzis-honor/details,A professional hitman and hitwoman fall in love.,['US'],"['English', 'Italian']","['Drama', 'Comedy', 'Romance', 'Crime']",84
Ran,1985,DIRECTING,FALSE,https://www.metacritic.com/movie/ran/details,"An adaptation of William Shakespeare’s King Lear, Ran considers the disastrous consequences of Lord Hidetora Ichimonji’s (Tatsuya Nakadai) decision to split his kingdom among his three sons.","['Japan', 'France']",['Japanese'],"['Action', 'Drama', 'War']",96
Witness,1985,DIRECTING,FALSE,https://www.metacritic.com/movie/witness/details,Samuel Lap (Haas) a young Amish boy witnesses a murder while visiting Philadelphia with his mother Rachel (McGillis). Detective John Book (Ford) goes undercover in Amish country when he realizes the killer is a corrupt cop out to kill the only witness.,['USA'],"['English', 'German']","['Drama', 'Thriller', 'Romance']",76
Three Men and a Cradle,1985,FOREIGN LANGUAGE FILM,FALSE,https://www.metacritic.com/movie/three-men-and-a-cradle/details,None,['FR'],['French'],['Comedy'],44
The Color Purple,1985,BEST PICTURE,FALSE,https://www.metacritic.com/movie/the-color-purple/details,"In rural Georgia during the first half of the 20th century, Celie (Whoopi Goldberg) is married off to an abusive man (Danny Glover) after becoming pregnant by her own father. Based on Alice Walker's Pulitzer Prize-winning novel.",['USA'],['English'],['Drama'],78
Blue Velvet,1986,DIRECTING,FALSE,https://www.metacritic.com/movie/blue-velvet/details,"Set in a small American town, Blue Velvet is a dark, sensuous mystery involving the intertwining lives of four very different individuals.  The film's painful realism reminds us that we are not immune to the disturbing events which transpire in Blue Velvet's sleepy community. There is a darker side of life waiting for us all.  (De Laurentiis Entertainment Group Inc.)",['USA'],['English'],"['Drama', 'Mystery', 'Thriller']",76
Hannah and Her Sisters,1986,DIRECTING,FALSE,https://www.metacritic.com/movie/hannah-and-her-sisters/details,A comic look at the relationships among three sisters and their various romantic interests.,['USA'],['English'],"['Drama', 'Comedy', 'Romance']",90
The Mission,1986,DIRECTING,FALSE,https://www.metacritic.com/movie/the-mission/details,Eighteenth century Spanish Jesuits try to protect a remote South American tribe in danger of falling under the rule of pro-slavery Portugal.,"['GB', 'FR']","['English', 'Spanish', 'Latin', 'Guarani']","['Adventure', 'Drama', 'History']",55
Platoon,1986,DIRECTING,TRUE,https://www.metacritic.com/movie/platoon/details,A young recruit in Vietnam faces a moral crisis when confronted with the horrors of war and the duality of man.,"['USA', 'UK']","['English', 'Vietnamese']","['Drama', 'War']",92
A Room with a View,1986,DIRECTING,FALSE,https://www.metacritic.com/movie/a-room-with-a-view/details,"Based on E.M. Forster's novel, Lucy, a young English woman (Bonham Carter), and her aunt (Smith) travel to Florence in the early 1900's.  When Lucy encounters a British gentleman in Italy and finds herself falling in love, she must choose between him and her fiancé back in England.",['UK'],"['English', 'Italian']","['Drama', 'Comedy', 'Romance']",83
Betty Blue,1986,FOREIGN LANGUAGE FILM,FALSE,https://www.metacritic.com/movie/betty-blue/details,A lackadaisical handyman and aspiring novelist tries to support his younger girlfriend as she slowly succumbs to madness.,['FR'],['French'],"['Drama', 'Romance']",56
The Decline of the American Empire,1986,FOREIGN LANGUAGE FILM,FALSE,https://www.metacritic.com/movie/the-decline-of-the-american-empire/details,"Eight friends who spend a weekend discussing their feelings about sex, love and marriage.",['CA'],"['English', 'French']","['Drama', 'Comedy']",60
Children of a Lesser God,1986,BEST PICTURE,FALSE,https://www.metacritic.com/movie/children-of-a-lesser-god/details,"A new speech teacher (William Hurt) at a school for the deaf falls in love with the janitor, a deaf woman (Marlee Matlin) speechless by choice.",['US'],"['English', 'ase']","['Drama', 'Romance']",80
Fatal Attraction,1987,DIRECTING,FALSE,https://www.metacritic.com/movie/fatal-attraction/details,"Fatal Attraction is a story too terrifying to resist, a crackling, tension-packed thriller hinged on the triangle of a man, a wife and vengeful ""other woman."" This sexy, chic, scary box-office smash grabs hold early-then tops itself with an unforgettably nerve-jolting finale. [Paramount Pictures]",['USA'],['English'],"['Drama', 'Thriller']",67
Hope and Glory,1987,DIRECTING,FALSE,https://www.metacritic.com/movie/hope-and-glory/details,"Bill, a young boy living on the outskirts of London experiences the exhilaration of World War II. During this period, Bill learns about sex, death, love, hypocrisy, and the faults of adults as he prowls the ruins of bombed houses.","['GB', 'US']",['English'],"['Drama', 'Comedy', 'Romance']",86
The Last Emperor,1987,DIRECTING,TRUE,https://www.metacritic.com/movie/the-last-emperor/details,The story of Pu Yi's life from his reign as Emperor to his last days as a peasant worker in the People's Republic.,"['China', 'UK', 'France', 'Italy']","['English', 'Mandarin', 'Russian', 'Japanese']","['Biography', 'Drama', 'History']",76
Moonstruck,1987,DIRECTING,FALSE,https://www.metacritic.com/movie/moonstruck/details,"In this romantic comedy, Loretta (Cher), a young widow, feels unlucky in love and is content to wed a man she does not love (Aiello)...until she meets and falls hopelessly in love with his younger brother (Cage).",['USA'],"['English', 'Italian']","['Drama', 'Comedy', 'Romance']",83
My Life as a Dog,1987,DIRECTING,FALSE,https://www.metacritic.com/movie/my-life-as-a-dog/details,"A boy and his brother don't get along well. In order to let their ill mother rest, they're separated and sent each one with their relatives.",['SE'],['Swedish'],"['Drama', 'Comedy']",82
Babette's Feast,1987,FOREIGN LANGUAGE FILM,TRUE,https://www.metacritic.com/movie/babettes-feast/details,"During the late 19th century, a strict religious community in a Danish village takes in a French refugee from the Franco-Prussian War as a servant to the late pastor's daughters.",['DK'],"['English', 'French', 'Italian', 'Danish', 'Swedish']",['Drama'],78
Broadcast News,1987,BEST PICTURE,FALSE,https://www.metacritic.com/movie/broadcast-news/details,"Tom Grunick, a rising anchorman, has plenty of on-camera savvy, personality and good looks but little in the way of brains. He may be dumb as a doornail but Tom's got the star presence his network needs. Then there's Aaron Altman, a less than good-looking newsman, who's dedicated, diligent and down-to-earth. Aaron would love to be an anchor but he freezes up the moment he's in front of the camera. Spunky, smart news producer Jane Craig is excellent at her job but has difficulty handling the pressure. Can these workaholics mask their personal quirks long enough to jump-start their professional lives? (20h Century Fox)",['USA'],['English'],"['Drama', 'Comedy', 'Romance']",84
A Fish Called Wanda,1988,DIRECTING,FALSE,https://www.metacritic.com/movie/a-fish-called-wanda/details,"In this zany comedy, four disparate characters (Cleese, Curtis, Kline, Palin) attempt a daring jewel heist.","['USA', 'UK']","['English', 'Russian', 'Italian']","['Comedy', 'Crime']",80
The Last Temptation of Christ,1988,DIRECTING,FALSE,https://www.metacritic.com/movie/the-last-temptation-of-christ/details,"A thought-provoking interpretation of the classic tale of Christ, Temptation explores the idea of Christ as a mere mortal, who, at the threshold of self-sacrifice, is tempted by the desire to continue on with his life.",['USA'],['English'],['Drama'],80
Mississippi Burning,1988,DIRECTING,FALSE,https://www.metacritic.com/movie/mississippi-burning/details,"A fictionalized version of the murders of three civil rights activists on June 21, 1964 in Mississippi. The FBI comes in to solve the case and succeeds only after using unethical and illegal means. (MGM)",['USA'],['English'],"['Drama', 'Mystery', 'Thriller', 'Crime']",65
Rain Man,1988,DIRECTING,TRUE,https://www.metacritic.com/movie/rain-man/details,"What begins with a cold-hearted attempt by one man to steal his autistic brother's inheritance evolves into a cross-country odyssey of love, family and self-discovery.",['USA'],"['English', 'Italian']",['Drama'],65
Working Girl,1988,DIRECTING,FALSE,https://www.metacritic.com/movie/working-girl/details,"Ambitious secretary Tess McGill (Melanie Griffith) makes her up the corporate ladder with a little creative deception by ""taking over"" when her boss Katherine Parker (Sigourney Weaver) breaks her leg on a ski trip.",['USA'],['English'],"['Drama', 'Comedy', 'Romance']",73
Women on the Verge of a Nervous Breakdown,1988,FOREIGN LANGUAGE FILM,FALSE,https://www.metacritic.com/movie/women-on-the-verge-of-a-nervous-breakdown/details,"The wildly hysterical international box office hit, women on the verge of a nervous breakdown, introduces us to Pepa who has just been jilted by an answering machine. The love of her life, Ivan, has just ended their relationship and she is heartbroken. But misery does love company. (MGM)",['Spain'],['Spanish'],"['Drama', 'Comedy']",85
The Accidental Tourist,1988,BEST PICTURE,FALSE,https://www.metacritic.com/movie/the-accidental-tourist/details,"An author of travel books (Hurt) sees his world turned upside down when his son dies, his wife (Turner) leaves him, and he meets an eccentric dog trainer (Davis).",['USA'],['English'],"['Drama', 'Romance']",53
Dangerous Liaisons,1988,BEST PICTURE,FALSE,https://www.metacritic.com/movie/dangerous-liaisons/details,"A cruel wager is made between the beautiful but deviousMarquise de Merteuil (Close) and her former lover, the Vicomte de Valmont (Malkovich). The Marquise challenges Valmont to seduce the virginal Cecile de Volanges (Thurman) before the girl can be wed. As a counter-challenge Valmont bets the Marquise that he will be able to bed the married Madame de Tourvel (Pfeiffer).","['USA', 'UK']",['English'],"['Drama', 'Romance']",74
Born on the Fourth of July,1989,DIRECTING,TRUE,https://www.metacritic.com/movie/born-on-the-fourth-of-july/details,"Based on a true story, the film follows the young Ron Kovic from a zealous teen who eagerly volunteers for the Vietnam War, to an embittered veteran paralyzed from the mid-chest down. Deeply in love with his country, Kovic returned to an environment vastly different from the one he left, and struggled before emerging as a brave new voice for the disenchanted. (Universal Studios)
",['USA'],"['English', 'Spanish']","['Biography', 'Drama', 'War']",75
Crimes and Misdemeanors,1989,DIRECTING,FALSE,https://www.metacritic.com/movie/crimes-and-misdemeanors/details,The film's title indicates the themes of two separate stories: 1) a renowned opthalmologist is desperate to cut off an adulterous relationship...which ends up in murder; and 2) an ethically frustrated documentary filmmaker woos an attractive television producer while making a film about her insufferably self-centered boss. [MGM],['USA'],['English'],"['Drama', 'Comedy']",77
Dead Poets Society,1989,DIRECTING,FALSE,https://www.metacritic.com/movie/dead-poets-society/details,"Robin Williams stars as John Keating, an unconventional teacher at a conservative New England prep school who inspires his students and encourages them with the rallying call ""carpe diem"" (seize the day).",['USA'],['English'],['Drama'],79
Henry V,1989,DIRECTING,FALSE,https://www.metacritic.com/movie/henry-v/details,The English king invades France and wins the Battle of Agincourt during the Hundred Years' War in Kenneth Branagh's adaptation of William Shakespeare's Henry V.,['UK'],"['English', 'French']","['Action', 'Drama', 'History', 'Romance', 'War']",83
My Left Foot,1989,DIRECTING,FALSE,https://www.metacritic.com/movie/my-left-foot/details,"True story of cerebral palsied Christy Brown, who overcame his illness and poverty to become an accomplished artist, poet and writer. ","['UK', 'Ireland']",['English'],"['Biography', 'Drama']",97
Cinema Paradiso,1989,FOREIGN LANGUAGE FILM,TRUE,https://www.metacritic.com/movie/cinema-paradiso/details,"Set in an Italian village, Salvatore finds himself enchanted by the flickering images at the Cinema Paradiso, yearning for the secret of the cinema’s magic. When the projectionist, Alfredo, agrees to reveal the mysteries of moviemaking, a deep friendship is born. The day comes for Salvatore to leave the village and pursue his dream of making movies of his own. Thirty years later he receives a message that beckons him back home to a secret and beautiful discovery that awaits him. [Miramax]","['France', 'Italy']","['English', 'Italian', 'Portuguese']","['Drama', 'Comedy', 'Romance']",80
Driving Miss Daisy,1989,BEST PICTURE,TRUE,https://www.metacritic.com/movie/driving-miss-daisy/details,This adaptation of Alfred Uhry's Pulitzer Prize-winning play looks at the 25-year relationship between an elderly Jewish woman and her African-American chauffeur.,['USA'],"['English', 'Hebrew']","['Drama', 'Comedy']",81
Field of Dreams,1989,BEST PICTURE,FALSE,https://www.metacritic.com/movie/field-of-dreams/details,"""If you build it, he will come."" With thes words, Iowa farmer Ray Kinsella (Costner) is inspired by a voice he can't ignore to pursue a dream he can hardly believe. Supported by his wife Annie (Madigan), Ray begins the quest by turning his ordinary cornfield into a place where dreams can come true. Along the way he meets reclusive activist Terence Mann (Jones), the mysterious ""Doc"" Graham (Lancaster), and even the legendary ""Shoeless Joe"" Jackson (Liotta). (Universal)",['USA'],['English'],"['Drama', 'Sport', 'Fantasy', 'Family']",57
Dances with Wolves,1990,DIRECTING,TRUE,https://www.metacritic.com/movie/dances-with-wolves/details,"Rewarded for his heroism in the Civil War, Lt. Dunbar (Costner) wants to see the American frontier before it is gone. He is assigned to an adandoned fort, where a sioux tribe is his only neighbor. Overcoming the language barrier and their mutual fear and distrust, Dunbar and the proud Indians gradually become friends. Eventually, he falls in love with the beautiful Stands With a Fist (McDonnell), a white woman raised by the tribe. (MGM)","['USA', 'UK']","['English', 'Sioux', 'Pawnee']","['Adventure', 'Drama', 'Western']",72
Goodfellas,1990,DIRECTING,FALSE,https://www.metacritic.com/movie/goodfellas/details,"Based on the bestselling book ""Wiseguy"" by Nicholas Pileggi, Scorsese's film profiles nearly 30 years of mob life in New York City.",['USA'],"['English', 'Italian']","['Biography', 'Drama', 'Crime']",90
The Grifters,1990,DIRECTING,FALSE,https://www.metacritic.com/movie/the-grifters/details,"When small-time cheat Roy Dillon (Cusack) winds up in the hospital following an unsuccessful scam, it sets up a confrontation between his estranged mother Lilly (Huston) and sexy girlfriend Myra (Bening). Both Lilly and Myra are ruthless confidence artists playing the con game in a league far above Roy ... and always looking for their next victim. The question soon becomes who's conning who as Roy finds himself caught in a complicated web of passion and mistrust. (Miramax)",['USA'],['English'],"['Drama', 'Thriller', 'Crime']",86
Reversal of Fortune,1990,DIRECTING,FALSE,https://www.metacritic.com/movie/reversal-of-fortune/details,"Jeremy Irons plays socialite Claus von Bulow, seeking legal exoneration in the most sensational attempted murder scandal of the 1980s. (Warner Bros.)","['USA', 'Japan', 'UK']",['English'],"['Drama', 'Mystery']",93
Cyrano de Bergerac,1990,FOREIGN LANGUAGE FILM,FALSE,https://www.metacritic.com/movie/cyrano-de-bergerac/details,"Embarrassed by his large nose, a romantic poet/soldier romances his cousin by proxy.",['FR'],['French'],"['Drama', 'History', 'Comedy', 'Romance']",79
Awakenings,1990,BEST PICTURE,FALSE,https://www.metacritic.com/movie/awakenings/details,"By opening one man's eyes to the world... he opened his own.  A true story of a maverick doctor and the patients whose lives he changes. Dr. Malcolm Sayer, a shy research physician who uses an experimental drug to ""awaken"" the catatonic victims of a rare disease beginning with Leonard, the first patient to receive the controversial treatment. His awakening, filled with awe and enthusiasm, proves a rebirth for Sayer too, as the exuberant patient reveals life's simple but unutterably sweet pleasures to the introverted doctor. Encouraged by Leonard's stunning recovery, Sayer administers the drug to the other patients. The story of their friendship during this emotional journey is a testament to both the tenderness of the human heart and the strength of the human soul. (Sony Pictures)",['USA'],['English'],['Drama'],74
Boyz n the Hood,1991,DIRECTING,FALSE,https://www.metacritic.com/movie/boyz-n-the-hood/details,"Tre Styles (Cuba Gooding Jr.), is a teen caught between the steady, forceful guidance of his father, Furious (Laurence Fishburne), and the inescapable violence of his South Central Los Angeles neighborhood.",['USA'],['English'],"['Drama', 'Crime']",76
Bugsy,1991,DIRECTING,FALSE,https://www.metacritic.com/movie/bugsy/details,"The story of how Benjamin ""Bugsy"" Siegel started Las Vegas.",['US'],['English'],"['Biography', 'Drama', 'Crime']",80
JFK,1991,DIRECTING,FALSE,https://www.metacritic.com/movie/jfk/details,"Jim Garrison, a New Orleans district attorney, discovers there's more to the Kennedy assassination than the official story.","['USA', 'France']","['English', 'Spanish']","['Biography', 'Drama', 'History', 'Mystery', 'Thriller', 'Crime']",72
The Silence of the Lambs,1991,DIRECTING,TRUE,https://www.metacritic.com/movie/the-silence-of-the-lambs/details,"In pursuit of one serial killer, ambitious FBI student Clarice Starling (Foster) is forced to enlist the aid of another notorious killer, the incarcerated ex-psychiatrist known as ""Hannibal the Cannibal"" Lecter (Hopkins). ",['USA'],['English'],"['Thriller', 'Crime']",85
The Prince of Tides,1991,BEST PICTURE,FALSE,https://www.metacritic.com/movie/the-prince-of-tides/details,A troubled man talks to his suicidal sister's psychiatrist about their family history and falls in love with her in the process.,['USA'],['English'],"['Drama', 'Romance']",65
The Crying Game,1992,DIRECTING,FALSE,https://www.metacritic.com/movie/the-crying-game/details,A psychological thriller centering on the kidnapping of a British soldier by the IRA.,"['Japan', 'UK']",['English'],"['Thriller', 'Romance', 'Crime']",90
Howards End,1992,DIRECTING,FALSE,https://www.metacritic.com/movie/howards-end/details,Merchant Ivory's adaptation of E.M. Forster's story of two unmarried sisters who befriend a poor young clerk and unwittingly ruin his life.,"['Japan', 'UK']","['English', 'German']","['Drama', 'Romance']",89
The Player,1992,DIRECTING,FALSE,https://www.metacritic.com/movie/the-player/details,"A Hollywood studio executive (Tim Robbins) with a shaky moral compass finds himself caught up in a criminal situation that would be right at home in one of his movie projects, in this biting industry satire from Robert Altman. Mixing elements of film noir with sly insider comedy, The Player, based on a novel by Michael Tolkin, functions as both a nifty stylish murder story and a commentary on its own making, and it is stocked with a heroic supporting cast (Peter Gallagher, Whoopi Goldberg, Greta Scacchi, Dean Stockwell, Fred Ward) and a lineup of star cameos that make for an astonishing Hollywood who’s who. This complexly woven grand entertainment (which kicks off with one of American cinema’s most audacious and acclaimed opening shots) was the film that marked Altman’s triumphant commercial comeback in the early 1990s.",['USA'],['English'],"['Drama', 'Mystery', 'Thriller', 'Comedy', 'Romance', 'Crime']",86
Scent of a Woman,1992,DIRECTING,FALSE,https://www.metacritic.com/movie/scent-of-a-woman/details,"Al Pacino won his first Best Actor Oscar for his brilliant portrayal of an overbearing, blind retired Lieutenant Colonel who hires a young guardian (O'Donnell), to assist him. It's a heart-wrenching and heartwarming tale of opposites attracting when they embark on a wild weekend trip that will change the lives of both men forever.  (Universal)",['USA'],['English'],['Drama'],59
Unforgiven,1992,DIRECTING,TRUE,https://www.metacritic.com/movie/unforgiven/details,"In this Academy Award winning western, Eastwood and Freeman are down-on-their-luck outlaws who pick up their guns one last time in order to collect a bounty offered by the vengeful prostitutes of remote Big Whiskey, Wyoming.",['USA'],['English'],"['Drama', 'Crime', 'Western']",85
A Few Good Men,1992,BEST PICTURE,FALSE,https://www.metacritic.com/movie/a-few-good-men/details,"One man is dead. Two are accused of murder. The entire Marine Corps is on trial. Hollywood heavyweights Cruise, Nicholson and Moore ignite the screen in Rob Reiner's acclaimed drama about the dangerous difference between following orders and following one's conscience. (Columbia TriStar)",['USA'],['English'],"['Drama', 'Mystery', 'Thriller', 'Crime']",62
In the Name of the Father,1993,DIRECTING,FALSE,https://www.metacritic.com/movie/in-the-name-of-the-father/details,Academy Award winner Daniel Day-Lewis gives an impassioned performance in this riveting drama that mirrors one man's 15-year struggle and ultimate triumph over a terrible injustice.  [Universal Studios],"['UK', 'Ireland']",['English'],"['Biography', 'Drama']",84
The Piano,1993,DIRECTING,FALSE,https://www.metacritic.com/movie/the-piano/details,"A seemingly mute woman (Hunter) is sent to New Zealand together with her daughter and her beloved piano, for an arranged marriage.","['France', 'Australia', 'New Zealand']","['English', 'British Sign Language', 'Maori']","['Drama', 'Romance']",89
The Remains of the Day,1993,DIRECTING,FALSE,https://www.metacritic.com/movie/the-remains-of-the-day/details,"Set just prior to World War II, this film focuses on the butler (Hopkins) in an English country home.","['USA', 'UK']","['English', 'German', 'French']","['Drama', 'Romance']",84
Schindler's List,1993,DIRECTING,TRUE,https://www.metacritic.com/movie/schindlers-list/details,Steven Spielberg's epic drama tells the compelling true story of German businessman Oskar Schindler (Neeson) who comes to Nazi-occupied Poland looking for economic prosperity and leaves as a savior. (History in Film),['USA'],"['English', 'German', 'Polish', 'Hebrew']","['Biography', 'Drama', 'History', 'War']",94
Short Cuts,1993,DIRECTING,FALSE,https://www.metacritic.com/movie/short-cuts/details,"Using the short stories of Raymond Carver as inspiration, Robert Altman revisits the formula of his 1975 film ""Nashville,"" portraying various interlocking stories set against the backdrop of contemporary middle-class Los Angeles.",['USA'],['English'],"['Drama', 'Comedy']",79
