name,year,competition_category,winner,url,summary,countries,languages,genre,metascore
Hugo ,2011,DIRECTING,FALSE,https://www.metacritic.com/movie/hugo/details,"Based on Brian Selznick's captivating and imaginative New York Times bestseller ""The Invention of Hugo Cabret."" Hugo Cabret, Scorsese's first film shot in 3D, tells the tale of an orphan boy living a secret life in the walls of a Paris train station. When Hugo encounters a broken machine, an eccentric girl, and the cold, reserved man who runs the toy shop, he is caught up in a magical, mysterious adventure that could put all of his secrets in jeopardy. (Sony Pictures)",['USA'],None,"['Mystery', 'Family']",83
Midnight in Paris,2011,DIRECTING,FALSE,https://www.metacritic.com/movie/midnight-in-paris/details,"This is a romantic comedy set in Paris about a family that goes there because of business, and two young people who are engaged to be married in the fall have experiences there that change their lives. It's about a young man's great love for a city, Paris and the illusion people have that a life different from theirs would be much better. (Sony Classic Pictures)","['USA', 'Spain']",['English'],"['Comedy', 'Romance']",81
The Tree of Life,2011,DIRECTING,FALSE,https://www.metacritic.com/movie/the-tree-of-life/details,"The film follows the life journey of the eldest son, Jack, through the innocence of childhood to his disillusioned adult years as he tries to reconcile a complicated relationship with his father. Jack finds himself a lost soul in the modern world, seeking answers to the origins and meaning of life while questioning the existence of faith. Through Malick's signature imagery, we see how both brute nature and spiritual grace shape not only our lives as individuals and families, but all life. (Fox Searchlight Pictures)

",['USA'],['English'],"['Drama', 'Fantasy']",85
Bullhead,2011,FOREIGN LANGUAGE FILM,FALSE,https://www.metacritic.com/movie/bullhead/details,"Bullhead is a harrowing tale of revenge, redemption and fate. Domineering cattle farmer Jacky Vanmarsenille, constantly pumped on steroids and hormones, initiates a shady deal with a notorious mafioso meat trader. When an investigating federal agent is assassinated and a woman from his traumatic past resurfaces, Jacky must confront his demons and face the far-reaching consequences of his decisions. (Drafthouse Films)",['Belgium'],"['French', 'Dutch', 'Flemish']","['Drama', 'Crime']",68
Footnote,2011,FOREIGN LANGUAGE FILM,FALSE,https://www.metacritic.com/movie/footnote/details,"Eliezer and Uriel Shkolnik are both eccentric professors, who have dedicated their lives to their work in Talmudic Studies. The father, Eliezer, is a stubborn purist who fears the establishment and has never been recognized for his work. Meanwhile his son, Uriel, is an up-and-coming star in the field, who appears to feed on accolades, endlessly seeking recognition. Then one day, the tables turn. When Eliezer learns that he is to be awarded the Israel Prize, the most valuable honor for scholarship in the country, his vanity and desperate need for validation are exposed. His son, Uriel, is thrilled to see his father's achievements finally recognized but, in a darkly funny twist, is forced to choose between the advancement of his own career and his father's. Will he sabotage his father's glory? (Sony Pictures Classics)
",['Israel'],['Hebrew'],['Drama'],83
In Darkness,2011,FOREIGN LANGUAGE FILM,FALSE,https://www.metacritic.com/movie/in-darkness/details,"In Darkness is based on a true story. Leopold Socha, a sewer worker and petty thief in Lvov, a Nazi occupied city in Poland, one day  encounters a group of Jews trying to escape the liquidation of the ghetto. He hides them for money in the labyrinth of the town’s sewers beneath the bustling activity of the city above. What starts out as a straightforward and cynical business arrangement turns into something very unexpected, the unlikely alliance between Socha and the Jews as the enterprise seeps deeper into Socha’s conscience. The film is also an extraordinary story of survival as these men, women and children all try to outwit certain death during 14 months of ever increasing and intense danger. [Sony Pictures Classics]","['Germany', 'Poland']","['German', 'Polish', 'Yiddish', 'Ukrainian']",['Drama'],74
Monsieur Lazhar,2011,FOREIGN LANGUAGE FILM,FALSE,https://www.metacritic.com/movie/monsieur-lazhar/details,"Monsieur Lazhar tells the story of a Montreal middle school class shaken by the death of their well-liked teacher. Bachir Lazhar, a 55-year-old Algerian immigrant, offers the school his services as a substitute teacher and is quickly hired. As he helps the children heal, he also learns to accept his own painful past. (Music Box Films)",['Canada'],"['English', 'French', 'Arabic']","['Drama', 'Comedy']",82
A Separation,2011,FOREIGN LANGUAGE FILM,TRUE,https://www.metacritic.com/movie/a-separation/details,"Set in contemporary Iran, A Separation is a compelling drama about the dissolution of a marriage. Simin wants to leave Iran with her husband Nader and daughter Termeh. Simin sues for divorce when Nader refuses to leave behind his Alzheimer-suffering father. Her request having failed, Simin returns to her parents' home, but Termeh decides to stay with Nader. When Nader hires a young woman to assist with his father in his wife's absence, he hopes that his life will return to a normal state. However, when he discovers that the new maid has been lying to him, he realizes that there is more on the line than just his marriage. [Sony Pictures Classic]

",['Iran'],['Persian'],['Drama'],95
The Help,2011,BEST PICTURE,FALSE,https://www.metacritic.com/movie/the-help/details,"Mississippi during the 1960s: Skeeter, a southern society girl, returns from college determined to become a writer, but turns her friends' lives--and a small Mississippi town--upside down when she decides to interview the black women who have spent their lives taking care of prominent southern families. Aibileen, Skeeter's best friend's housekeeper, is the first to open up—to the dismay of her friends in the tight-knit black community. Despite Skeeter's life-long friendships hanging in the balance, she and Aibileen continue their collaboration and soon more women come forward to tell their stories—and as it turns out, they have a lot to say. Along the way, unlikely friendships are forged and a new sisterhood emerges, but not before everyone in town has a thing or two to say themselves when they become unwittingly—and unwillingly—caught up in the changing times. (Walt Disney Pictures)


",None,None,['Drama'],62
Moneyball,2011,BEST PICTURE,FALSE,https://www.metacritic.com/movie/moneyball/details,"Based on Michael Lewis' nonfiction bestseller ""Moneyball: The Art of Winning an Unfair Game,"" the book's subject is Oakland A's general manager Billy Beane, who assembled a contending baseball club on a shoestring budget by employing a sophisticated computer-based analysis to draft players. (Sony Pictures)
",None,None,['Drama'],87
War Horse,2011,BEST PICTURE,FALSE,https://www.metacritic.com/movie/war-horse/details,"Set against a sweeping canvas of rural England and Europe during the First World War, War Horse begins with the remarkable friendship between a horse named Joey and a young man called Albert, who tames and trains him. When they are forcefully parted, the film follows the extraordinary journey of the horse as he moves through the war, changing and inspiring the lives of all those he meets—British cavalry, German soldiers, and a French farmer and his granddaughter—before the story reaches its emotional climax in the heart of No Man's Land. The First World War is experienced through the journey of this horse—an odyssey of joy and sorrow, passionate friendship and high adventure. War Horse is one of the great stories of friendship and war—a successful book, it was turned into a hugely successful international theatrical hit that is arriving on Broadway next year. It now comes to screen in an epic adaptation by one of the great directors in film history. (DreamWorks Pictures)

","['USA', 'UK']",['English'],['War'],72
Amour,2012,DIRECTING,FALSE,https://www.metacritic.com/movie/amour/details,"Georges and Anne are in their eighties. They are cultivated, retired music teachers. Their daughter, who is also a musician, lives abroad with her family. One day, Anne has an attack. The couple's bond of love is severely tested. [Sony Pictures Classics]","['Germany', 'France', 'Austria']","['English', 'French']","['Drama', 'Romance']",94
Beasts of the Southern Wild,2012,DIRECTING,FALSE,https://www.metacritic.com/movie/beasts-of-the-southern-wild/details,"In a forgotten but defiant bayou community cut off from the rest of the world by a sprawling levee, a six-year-old girl exists on the brink of orphanhood. Buoyed by her childish optimism and extraordinary imagination, she believes that the natural world is in balance with the universe until a fierce storm changes her reality. Desperate to repair the structure of her world in order to save her ailing father and sinking home, this tiny hero must learn to survive unstoppable catastrophes of epic proportions. (Fox Searchlight Pictures)",['USA'],['English'],"['Drama', 'Fantasy']",86
Life of Pi,2012,DIRECTING,TRUE,https://www.metacritic.com/movie/life-of-pi/details,"Based on the best-selling novel by Yann Martel, is a magical adventure story centering on Pi Patel, the precocious son of a zookeeper. Dwellers in Pondicherry, India, the family decides to move to Canada, hitching a ride on a huge freighter. After a shipwreck, Pi is found adrift in the Pacific Ocean on a 26-foot lifeboat with a zebra, a hyena, an orangutan and a 450-pound Bengal tiger named Richard Parker, all fighting for survival.","['USA', 'China', 'Taiwan']","['English', 'French', 'Tamil']","['Adventure', 'Drama']",79
Lincoln,2012,DIRECTING,FALSE,https://www.metacritic.com/movie/lincoln/details,"Lincoln is a revealing drama that focuses on the 16th President's tumultuous final months in office. In a nation divided by war and the strong winds of change, Lincoln pursues a course of action designed to end the war, unite the country and abolish slavery. With the moral courage and fierce determination to succeed, his choices during this critical moment will change the fate of generations to come. (DreamWorks Pictures)","['USA', 'India']",['English'],"['Biography', 'Drama', 'History', 'War']",86
Silver Linings Playbook,2012,DIRECTING,FALSE,https://www.metacritic.com/movie/silver-linings-playbook/details,"Life doesn’t always go according to plan...Pat Solitanohas lost everything -- his house, his job, and his wife.  He now finds himself living back with his mother and father after spending eight months in a state institution on a plea bargain. Pat is determined to rebuild his life, remain positive and reunite with his wife, despite the challenging circumstances of their separation.  All Pat’s parents want is for him to get back on his feet - and to share their family’s obsession with the Philadelphia Eagles football team.   When Pat meets Tiffany, a mysterious girl with problems of her own, things get complicated. Tiffany offers to help Pat reconnect with his wife, but only if he'll do something very important for her in return.   As their deal plays out, an unexpected bond begins to form between them, and silver linings appear in both of their lives. (The Weinstein Company)",['USA'],['English'],"['Drama', 'Comedy', 'Romance']",81
Kon-Tiki,2012,FOREIGN LANGUAGE FILM,FALSE,https://www.metacritic.com/movie/kon-tiki/details,"The story of legendary explorer Thor Heyerdal's epic 4,300 miles crossing of the Pacific on a balsa wood raft in 1947, in an effort prove it was possible for South Americans to settle in Polynesia in pre-Columbian times.","['Germany', 'UK', 'Norway', 'Denmark', 'Sweden']","['English', 'French', 'Swedish', 'Norwegian']","['Action', 'Adventure', 'Biography', 'Drama', 'History']",62
There Is No Evil,2012,FOREIGN LANGUAGE FILM,FALSE,https://www.metacritic.com/movie/there-is-no-evil/details,The four stories that are variations on the crucial themes of moral strength and the death penalty that ask to what extent individual freedom can be expressed under a despotic regime and its seemingly inescapable threats.,"['DE', 'CZ', 'IR']",['Persian'],['Drama'],81
A Royal Affair,2012,FOREIGN LANGUAGE FILM,FALSE,https://www.metacritic.com/movie/a-royal-affair/details,"A Royal Affair is the true story of an ordinary man who wins the queen's heart and starts a revolution. Centering on the intriguing love triangle between the ever more insane Danish King Christian VII (Mikkel Boe Følsgaard), the royal physician who is a man of enlightenment and idealism Struensee and the young but strong Queen Caroline Mathilda, A Royal Affair is the gripping tale of brave idealists who risk everything in their pursuit of freedom for their people… Above all it is the story of a passionate and forbidden romance that changed an entire nation. (Magnolia Pictures)","['Czech Republic', 'Denmark', 'Sweden']","['English', 'German', 'French', 'Danish']","['Drama', 'History', 'Romance']",73
War Witch,2012,FOREIGN LANGUAGE FILM,FALSE,https://www.metacritic.com/movie/war-witch/details,"Komona (Rachel Mwanza) is only 12 years old when she is kidnapped by rebel soldiers and enslaved to a life of guerrilla warfare in the African jungle. Forced to commit unspeakable acts of brutality, she finds hope for survival in protective, ghost-like visions and in a tender relationship with a fellow soldier named Magician (Serge Kanyinda). Together, they manage to escape the rebels' clutches, but their freedom proves short-lived.  Komona then decides she must make amends with her past. [Tribeca Film]",['Canada'],"['French', 'Lingala']","['Drama', 'War']",84
Argo,2012,BEST PICTURE,TRUE,https://www.metacritic.com/movie/argo/details,"Based on true events, “Argo” chronicles the life-or-death covert operation to rescue six Americans, which unfolded behind the scenes of the Iran hostage crisis—the truth of which was unknown by the public for decades. On November 4, 1979, as the Iranian revolution reaches its boiling point, militants storm the U.S. embassy in Tehran, taking 52 Americans hostage. But, in the midst of the chaos, six Americans manage to slip away and find refuge in the home of the Canadian ambassador. Knowing it is only a matter of time before the six are found out and likely killed, a CIA “exfiltration” specialist named Tony Mendez comes up with a risky plan to get them safely out of the country. A plan so incredible, it could only happen in the movies. (Warner Bros.)",['USA'],None,['Drama'],86
Django Unchained,2012,BEST PICTURE,FALSE,https://www.metacritic.com/movie/django-unchained/details,"Django is a slave whose brutal history with his former owners lands him face-to-face with German-born bounty hunter Dr. King Schultz.  Schultz is on the trail of the murderous Brittle brothers, and only Django can lead him to his bounty.  The unorthodox Schultz acquires Django with a promise to free him upon the capture of the Brittles – dead or alive. (The Weinstein Company)",['USA'],"['English', 'German', 'French']","['Action', 'Adventure', 'Drama', 'Crime', 'Western']",81
Zero Dark Thirty,2012,BEST PICTURE,FALSE,https://www.metacritic.com/movie/zero-dark-thirty/details,"For a decade, an elite team of intelligence and military operatives, working in secret across the globe, devoted themselves to a single goal: to find and eliminate Osama bin Laden. [Columbia Pictures]",['USA'],"['English', 'Arabic']","['Action', 'Drama', 'History', 'Thriller']",95
American Hustle,2013,DIRECTING,FALSE,https://www.metacritic.com/movie/american-hustle/details,"A fictional film set in the alluring world of one of the most stunning scandals to rock our nation, American Hustle tells the story of con man Irving Rosenfeld (Christian Bale), who along with his equally cunning and seductive partner Sydney Prosser (Amy Adams) is forced to work for a wild FBI agent Richie DiMaso (Bradley Cooper). DiMaso pushes them into a world of Jersey powerbrokers and mafia that's as dangerous as it is enchanting. Caught between the con-artists and Feds is Carmine Polito (Jeremy Renner), the passionate, volatile, New Jersey political operator, but it's Irving's unpredictable wife Rosalyn (Jennifer Lawrence) who could be the one to pull the thread that brings the entire world crashing down. [Sony Pictures]",['USA'],"['English', 'Arabic']","['Drama', 'History', 'Thriller', 'Crime']",90
Gravity,2013,DIRECTING,TRUE,https://www.metacritic.com/movie/gravity/details,"Dr. Ryan Stone (Sandra Bullock) is a brilliant medical engineer on her first shuttle mission, with veteran astronaut Matt Kowalsky (George Clooney) in command of his last flight before retiring. But on a seemingly routine spacewalk, disaster strikes. The shuttle is destroyed, leaving Stone and Kowalsky completely alone - tethered to nothing but each other and spiraling out into the blackness. The deafening silence tells them they have lost any link to Earth - and any chance for rescue. As fear turns to panic, every gulp of air eats away at what little oxygen is left. But the only way home may be to go further out into the terrifying expanse of space.","['USA', 'UK']","['English', 'Spanish', 'Greenlandic']","['Sci-Fi', 'Drama', 'Mystery', 'Thriller']",96
Nebraska,2013,DIRECTING,FALSE,https://www.metacritic.com/movie/nebraska/details,"An aging, booze-addled father makes the trip from Montana to Nebraska with his estranged son in order to claim a million dollar Mega Sweepstakes Marketing prize.",['USA'],"['English', 'Spanish']","['Adventure', 'Drama']",87
12 Years a Slave,2013,DIRECTING,FALSE,https://www.metacritic.com/movie/12-years-a-slave/details,"In the pre-Civil War United States, Solomon Northup, a free black man living in upstate New York, is abducted and sold into slavery.","['USA', 'UK']",['English'],"['Biography', 'Drama', 'History']",96
The Wolf of Wall Street,2013,DIRECTING,FALSE,https://www.metacritic.com/movie/the-wolf-of-wall-street/details,"An adaptation of Jordan Belfort's memoir chronicling his rise and fall on Wall Street and his hard-partying, addiction-fueled personal life.",['USA'],"['English', 'French']","['Biography', 'Drama', 'Comedy', 'Crime']",75
The Broken Circle Breakdown,2013,FOREIGN LANGUAGE FILM,FALSE,https://www.metacritic.com/movie/the-broken-circle-breakdown/details," Elise (Veerle Baetens) and Didier (Johan Heldenbergh) fall in love at first sight. She has her own tattoo shop and he plays the banjo in a bluegrass band. They bond over their shared enthusiasm for American music and culture, and dive headfirst into a sweeping romance that plays out on and off stage","['Netherlands', 'Belgium']","['English', 'Flemish']","['Drama', 'Romance', 'Music']",70
The Great Beauty,2013,FOREIGN LANGUAGE FILM,TRUE,https://www.metacritic.com/movie/the-great-beauty/details,"Jep Gambardella has seduced his way through the lavish nightlife of Rome for decades, but after his 65th birthday and a shock from the past, Jep looks past the nightclubs and parties to find a timeless landscape of absurd, exquisite beauty.","['France', 'Italy']","['Spanish', 'Chinese', 'Italian', 'Japanese']","['Drama', 'Comedy']",86
The Missing Picture,2013,FOREIGN LANGUAGE FILM,FALSE,https://www.metacritic.com/movie/the-missing-picture/details,"Rithy Panh uses clay figures, archival footage, and narration to revisit the atrocities committed by Cambodia's Khmer Rouge between 1975 and 1979.","['France', 'Cambodia']",['French'],['Documentary'],87
Omar,2013,FOREIGN LANGUAGE FILM,FALSE,https://www.metacritic.com/movie/omar/details,"A tense, gripping thriller about betrayal, suspected and real, in the Occupied Territories. Omar (Adam Bakri) is a Palestinian baker who routinely climbs over the separation wall to meet up with his girl Nadja (Leem Lubany). By night, he’s either a freedom fighter or a terrorist—you decide—ready to risk his life to strike at the Israeli military with his childhood friends Tarek (Eyad Hourani) and Amjad (Samer Bisharat). Arrested after the killing of an Israeli soldier and tricked into an admission of guilt by association, he agrees to work as an informant. So begins a dangerous game—is he playing his Israeli handler (Waleed F. Zuaiter) or will he really betray his cause? And who can he trust on either side? Palestinian filmmaker Hany Abu-Assad (Paradise Now) has made a dynamic, action-packed drama about the insoluable moral dilemmas and tough choices facing those on the frontlines of a conflict that shows no sign of letting up. [Adopt Films]",['Occupied Palestinian Territory'],"['Arabic', 'Hebrew']","['Drama', 'Thriller']",75
Captain Phillips,2013,BEST PICTURE,FALSE,https://www.metacritic.com/movie/captain-phillips/details,"The true story of Captain Richard Phillips and the 2009 hijacking by Somali pirates of the US-flagged MV Maersk Alabama, the first American cargo ship to be hijacked in two hundred years.",['USA'],"['English', 'Somali']","['Action', 'Adventure', 'Biography', 'Drama', 'Thriller', 'Crime']",82
Dallas Buyers Club,2013,BEST PICTURE,FALSE,https://www.metacritic.com/movie/dallas-buyers-club/details,"Loosely based on the true-life tale of Ron Woodroof, a drug taking, women loving, homophobic man who, in 1985 was diagnosed with full blown HIV/AIDS and given thirty days to live. He started taking the FDA approved AZT, the only legal drug available in the U.S, which brought him to the brink of death. To survive, he smuggled non-toxic, anti-viral medications from all over the world yet still illegal in the U.S. Other AIDS patients sought out his medications forgoing hospitals, doctors and AZT. With the help of his doctor, Eve Saks and a fellow patient, Rayon, Ron unintentionally created the Dallas Buyers Club, the first of dozens which would form around the country, providing its paying members with these alternative treatments. The clubs, growing in numbers and clientele, were brought to the attention of the FDA and pharmaceutical companies which waged an all out war on Ron.",['USA'],"['English', 'Japanese']","['Biography', 'Drama', 'History']",80
Her,2013,BEST PICTURE,FALSE,https://www.metacritic.com/movie/her/details,"Set in the Los Angeles of the slight future, Her follows Theodore Twombly, a complex, soulful man who makes his living writing touching, personal letters for other people. Heartbroken after the end of a long relationship, he becomes intrigued with a new, advanced operating system, which promises to be an intuitive entity in its own right, individual to each user. Upon initiating it, he is delighted to meet ""Samantha,"" a bright, female voice, who is insightful, sensitive and surprisingly funny. As her needs and desires grow, in tandem with his own, their friendship deepens into an eventual love for each other. [Warner Bros.]",['USA'],['English'],"['Sci-Fi', 'Drama', 'Comedy', 'Romance']",90
Philomena,2013,BEST PICTURE,FALSE,https://www.metacritic.com/movie/philomena/details,"A world-weary political journalist picks up the story of a woman's search for her son, who was taken away from her decades ago after she became pregnant and was forced to live in a convent.","['USA', 'UK', 'France']",['English'],['Drama'],77
Boyhood,2014,DIRECTING,FALSE,https://www.metacritic.com/movie/boyhood/details,"Filmed over 12 years with the same cast, Richard Linklater's Boyhood is a groundbreaking story of growing up as seen through the eyes of a child named Mason (Ellar Coltrane), who literally grows up on screen before our eyes. Starring Ethan Hawke and Patricia Arquette as Mason's parents and newcomer Lorelei Linklater as his sister Samantha, Boyhood charts the rocky terrain of childhood like no other film has before and is both a nostalgic time capsule of the recent past and an ode to growing up and parenting. [IFC Films]",['USA'],"['English', 'Spanish']",['Drama'],None
Foxcatcher,2014,DIRECTING,FALSE,https://www.metacritic.com/movie/foxcatcher/details,Foxcatcher tells the true story of Olympic Wrestling Champion brothers Mark Schultz (Channing Tatum) and Dave Schultz (Mark Ruffalo) and their relationship with the eccentric John du Pont (Steve Carell) that led to murder. [Sony Pictures Classics],['USA'],['English'],"['Biography', 'Drama', 'Sport', 'Thriller']",81
The Grand Budapest Hotel,2014,DIRECTING,FALSE,https://www.metacritic.com/movie/the-grand-budapest-hotel/details,"The Grand Budapest Hotel recounts the adventures of M. Gustave, a legendary concierge at a famous European hotel between the wars, and Zero Moustafa, the lobby boy who becomes his most trusted friend. The story involves the theft and recovery of a priceless Renaissance painting and the battle for an enormous family fortune—all against the back-drop of a suddenly and dramatically changing continent. [Fox Searchlight]","['USA', 'Germany', 'UK']","['English', 'French']","['Drama', 'Comedy']",88
The Imitation Game,2014,DIRECTING,FALSE,https://www.metacritic.com/movie/the-imitation-game/details,"During the winter of 1952, British authorities entered the home of mathematician, cryptanalyst and war hero Alan Turing (Benedict Cumberbatch) to investigate a reported burglary. They instead ended up arresting Turing himself on charges of ‘gross indecency’, an accusation that would lead to his devastating conviction for the criminal offense of homosexuality – little did officials know, they were actually incriminating the pioneer of modern-day computing. Famously leading a motley group of scholars, linguists, chess champions and intelligence officers, he was credited with cracking the so-called unbreakable codes of Germany's World War II Enigma machine. [The Weinstein Company]","['USA', 'UK']","['English', 'German']","['Biography', 'Drama', 'Thriller', 'War']",73
